{
  "model_id": "evo2",
  "status": "INCLUDED",
  "model_name": "Evo2 7B",
  "source": "https://github.com/ArcInstitute/evo2",
  "license": "Apache-2.0",
  "checkpoint": "evo2_7b",
  "revision": "4b509ec2a22d6de472659f908bcb0714265ad3a7",
  "input_contract": {
    "assembly": "GRCh38",
    "alphabet": "ACGT",
    "context_lengths_bp": [8192],
    "variant_scoring": true
  },
  "score_contract": {
    "score_semantics": "alternate_minus_reference_log_likelihood",
    "score_direction": "unknown",
    "orientation_support": "forward_and_reverse"
  },
  "capabilities": {
    "raw_score": true,
    "embeddings": true,
    "fine_tuning": false,
    "batch": true
  },
  "hardware": {
    "backend": "modal",
    "gpu": "H100",
    "memory_gb": 80
  },
  "provenance": {
    "verified_at": "2026-09-21",
    "verification_status": "VERIFIED",
    "notes": "Required candidate. Official source, Apache-2.0 license, pinned revision, 8192-bp raw-score contract, H100 model load, real forward/reverse SNV pilot, persistent prediction cache, and equivalent cache hit are verified. Evidence: artifacts/modal/phase2_phase4_pilot_20260921_success.json. Per-request billed USD is unavailable; workspace-level billing is recorded there.",
    "asset_checksum": null
  }
}
